{
  "system_version": "0.1.0",
  "sync_cycle_id": "sync-2026-04-16-001",
  "updated_at_utc": "2026-04-16T00:00:00Z",
  "compatibility_state": "compatible",
  "control_plane": {
    "repo": "repo-47",
    "branch": "control",
    "commit": "TBD0000"
  },
  "runtime_plane": {
    "repo": "repo-48",
    "branch": "runtime",
    "commit": "TBD0000"
  },
  "contracts": {
    "event_schema_version": "v1",
    "message_schema_version": "v1"
  }
}
